### ISSUE TITLE
Unicast DHCP request packets not handled

### ISSUE THREAD

**Issue by JustinAzoff** [oxidecomputer/opte#946]
The initial DHCP request is a broadcast packet:

```
22:52:49.998312 IP 0.0.0.0.68 > 255.255.255.255.67: BOOTP/DHCP, Request from a8:40:25:f0:00:01, length 297
22:52:49.998394 IP 172.30.0.1.67 > 172.30.0.6.68: BOOTP/DHCP, Reply, length 304
```

But a renewal is a unicast packet to the current dhcp server:

```
22:57:19.834564 IP 172.30.0.6.68 > 172.30.0.1.67: BOOTP/DHCP, Request from a8:40:25:f0:00:01, length 291
```

And we are not handling those.

https://github.com/oxidecomputer/opte/blob/5d0c81948b6160eb53939532761fa3a8036e0e24/lib/opte/src/engine/dhcp.rs#L436-L441
